{"schema_version":2,"feature_id":"001-adopt-spec-anchoring","task_id":"T030","requirement_ids":["REQ-CONTRACTS-001"],"evidence_mode":"tdd","spec_snapshot":{"path":"docs/evidence/specs/5af921cd3337311540d79e50b86bff536797cba47b3c4ec3f459b27aace7937e.md","sha256":"5af921cd3337311540d79e50b86bff536797cba47b3c4ec3f459b27aace7937e"},"red":{"command":"python3 -m unittest","exit_code":1,"summary":"EvidenceRecordV2 validation was absent."},"green":{"command":"python3 -m unittest","exit_code":0,"summary":"EvidenceRecordV2 validation passes."},"mutation":{"command":"python3 -m unittest","exit_code":0,"summary":"Invalid evidence mutations are rejected.","killed":true},"recorded_at":"2026-09-01T00:00:00Z"}
